{
  "slot_id": "MEM_08",
  "question": "처음 그림과 비교했을 때 새로 나타난 물건은 무엇인가요?",
  "answer": "우산",
  "answer_rationale": "검사 그림은 학습 그림을 그대로 복제한 뒤 우산 낱개 하나만 추가하므로, 새로 나타난 물건은 우산뿐이다.",
  "panels": [
    {
      "stage": "학습",
      "kind": "scene",
      "scene": {
        "layout": "grid",
        "rows": 2,
        "cols": 3,
        "background": "흰 바닥이 보인다",
        "objects": [
          {
            "ref": "cup",
            "name": "머그컵",
            "appearance": "손잡이가 달린 흰색 낱개 하나",
            "cell": [
              0,
              0
            ]
          },
          {
            "ref": "apple",
            "name": "사과",
            "appearance": "빨간 사과 낱개 하나",
            "cell": [
              0,
              1
            ]
          },
          {
            "ref": "comb",
            "name": "빗",
            "appearance": "검은색 손잡이 빗 낱개 하나",
            "cell": [
              0,
              2
            ]
          },
          {
            "ref": "key",
            "name": "열쇠",
            "appearance": "은색 금속 열쇠 낱개 하나",
            "cell": [
              1,
              0
            ]
          },
          {
            "ref": "book",
            "name": "책",
            "appearance": "파란 표지의 닫힌 책 한 권",
            "cell": [
              1,
              1
            ]
          }
        ]
      }
    },
    {
      "stage": "검사",
      "kind": "edit",
      "edit_of": "학습",
      "changes": [
        {
          "op": "add",
          "target": "umbrella",
          "object": {
            "ref": "umbrella",
            "name": "우산",
            "appearance": "손잡이가 굽은 접힌 노란색 우산 낱개 하나",
            "cell": [
              1,
              2
            ],
            "is_target": true
          }
        }
      ]
    }
  ]
}