{
  "slot_id": "MEM_01",
  "question": "방금 본 물건 네 가지를 모두 말씀해 주세요.",
  "answer": "머그컵, 열쇠, 사과, 책",
  "answer_rationale": "학습 장면에는 머그컵, 열쇠, 사과, 책이 각각 한 개씩 있으며 다른 물건은 없다.",
  "panels": [
    {
      "stage": "학습",
      "kind": "scene",
      "scene": {
        "layout": "grid",
        "rows": 2,
        "cols": 2,
        "background": "흰 바닥",
        "objects": [
          {
            "ref": "cup",
            "name": "머그컵",
            "appearance": "손잡이가 달린 흰색 낱개 하나",
            "cell": [
              0,
              0
            ],
            "is_target": true
          },
          {
            "ref": "key",
            "name": "열쇠",
            "appearance": "금속 열쇠 낱개 하나",
            "cell": [
              0,
              1
            ],
            "is_target": true
          },
          {
            "ref": "apple",
            "name": "사과",
            "appearance": "꼭지가 달린 낱개 하나",
            "color": "빨강",
            "cell": [
              1,
              0
            ],
            "is_target": true
          },
          {
            "ref": "book",
            "name": "책",
            "appearance": "파란색 표지의 닫힌 낱권 한 권",
            "cell": [
              1,
              1
            ],
            "is_target": true
          }
        ]
      }
    }
  ]
}