{
  "slot_id": "MEM_02",
  "question": "처음 본 그림과 물건의 색, 위치, 크기가 모두 같은 것은 몇 번인가요?",
  "answer": "3",
  "answer_rationale": "3번만 학습 그림과 동일하다. 1번은 사과의 색, 2번은 열쇠의 위치, 4번은 머그컵의 크기가 달라졌다.",
  "panels": [
    {
      "stage": "학습",
      "kind": "scene",
      "scene": {
        "layout": "grid",
        "rows": 2,
        "cols": 3,
        "background": "흰 바닥이 보인다",
        "objects": [
          {
            "ref": "apple",
            "name": "사과",
            "appearance": "낱개 하나",
            "color": "빨강",
            "cell": [
              0,
              0
            ],
            "is_target": true
          },
          {
            "ref": "key",
            "name": "열쇠",
            "appearance": "열쇠고리 없는 금속 낱개 하나",
            "cell": [
              0,
              1
            ],
            "is_target": true
          },
          {
            "ref": "cup",
            "name": "머그컵",
            "appearance": "손잡이 달린 흰색 낱개 하나",
            "cell": [
              1,
              0
            ],
            "is_target": true
          },
          {
            "ref": "leaf",
            "name": "나뭇잎",
            "appearance": "타원형 낱개 하나",
            "color": "초록",
            "cell": [
              1,
              2
            ]
          }
        ]
      }
    },
    {
      "stage": "검사 보기",
      "kind": "option",
      "option_index": 1,
      "edit_of": "학습",
      "changes": [
        {
          "op": "recolor",
          "target": "apple",
          "to_color": "초록"
        }
      ]
    },
    {
      "stage": "검사 보기",
      "kind": "option",
      "option_index": 2,
      "edit_of": "학습",
      "changes": [
        {
          "op": "move",
          "target": "key",
          "to_cell": [
            0,
            2
          ]
        }
      ]
    },
    {
      "stage": "검사 보기",
      "kind": "option",
      "option_index": 3,
      "edit_of": "학습"
    },
    {
      "stage": "검사 보기",
      "kind": "option",
      "option_index": 4,
      "edit_of": "학습",
      "changes": [
        {
          "op": "rescale",
          "target": "cup",
          "to_scale": 1.6
        }
      ]
    }
  ]
}