{
  "slot_id": "VIS_04",
  "question": "다음 중 기준 그림의 일부를 완성한 그림은 무엇인가요?",
  "answer": "1",
  "answer_rationale": "기준 그림의 일부를 완성한 그림은 1번 보기에만 나타난다.",
  "panels": [
    {
      "stage": "기준",
      "kind": "scene",
      "scene": {
        "layout": "grid",
        "rows": 2,
        "cols": 2,
        "background": "흰 바닥",
        "objects": [
          {
            "ref": "square",
            "name": "사각형",
            "color": "파랑",
            "cell": [
              0,
              0
            ]
          },
          {
            "ref": "triangle",
            "name": "삼각형",
            "color": "빨강",
            "cell": [
              0,
              1
            ]
          },
          {
            "ref": "circle",
            "name": "원",
            "color": "노랑",
            "cell": [
              1,
              0
            ]
          },
          {
            "ref": "star",
            "name": "별",
            "color": "초록",
            "cell": [
              1,
              1
            ]
          }
        ]
      }
    },
    {
      "stage": "보기",
      "kind": "option",
      "option_index": 1,
      "edit_of": "기준",
      "changes": [
        {
          "op": "remove",
          "target": "star"
        }
      ]
    },
    {
      "stage": "보기",
      "kind": "option",
      "option_index": 2,
      "edit_of": "기준",
      "changes": [
        {
          "op": "remove",
          "target": "triangle"
        },
        {
          "op": "remove",
          "target": "circle"
        }
      ]
    },
    {
      "stage": "보기",
      "kind": "option",
      "option_index": 3,
      "edit_of": "기준",
      "changes": [
        {
          "op": "remove",
          "target": "square"
        },
        {
          "op": "remove",
          "target": "triangle"
        }
      ]
    },
    {
      "stage": "보기",
      "kind": "option",
      "option_index": 4,
      "edit_of": "기준",
      "changes": [
        {
          "op": "remove",
          "target": "circle"
        },
        {
          "op": "remove",
          "target": "star"
        }
      ]
    }
  ]
}