{
  "slot_id": "VIS_01",
  "question": "그림을 시계 방향으로 90도 회전한 것은 어느 보기인가?",
  "answer": "2",
  "answer_rationale": "기준의 L자형 블록은 짧은 팔이 오른쪽을 향한다. 시계 방향으로 90도 회전하면 짧은 팔이 아래를 향한다. 보기 2만 90도 회전이고, 보기 1은 180도, 보기 3은 270도, 보기 4는 원래 방향이므로 정답은 2이다.",
  "panels": [
    {
      "stage": "기준",
      "kind": "scene",
      "scene": {
        "layout": "free",
        "background": "흰 바닥",
        "objects": [
          {
            "ref": "shape",
            "name": "L자형 블록",
            "appearance": "짧은 팔이 오른쪽으로 뻗은 검은색 L자형 블록 하나",
            "color": "검정",
            "pos": [
              0.5,
              0.5
            ],
            "rotation": 0,
            "is_target": true
          }
        ]
      }
    },
    {
      "stage": "보기",
      "kind": "option",
      "option_index": 1,
      "edit_of": "기준",
      "changes": [
        {
          "op": "rotate",
          "target": "shape",
          "to_rotation": 180
        }
      ]
    },
    {
      "stage": "보기",
      "kind": "option",
      "option_index": 2,
      "edit_of": "기준",
      "changes": [
        {
          "op": "rotate",
          "target": "shape",
          "to_rotation": 90
        }
      ]
    },
    {
      "stage": "보기",
      "kind": "option",
      "option_index": 3,
      "edit_of": "기준",
      "changes": [
        {
          "op": "rotate",
          "target": "shape",
          "to_rotation": 270
        }
      ]
    },
    {
      "stage": "보기",
      "kind": "option",
      "option_index": 4,
      "edit_of": "기준"
    }
  ]
}