{
  "slot_id": "ATT_03",
  "question": "사과는 모두 몇 개입니까?",
  "answer": "4개",
  "answer_rationale": "사과가 서로 다른 칸에 한 개씩 총 4개 있다. 나머지 5개는 배이므로 세지 않는다.",
  "panels": [
    {
      "stage": "main",
      "kind": "scene",
      "scene": {
        "layout": "grid",
        "rows": 3,
        "cols": 3,
        "background": "흰 바닥이 보인다",
        "objects": [
          {
            "ref": "apple1",
            "name": "사과",
            "appearance": "꼭지가 달린 낱개 하나",
            "color": "빨강",
            "cell": [
              0,
              0
            ],
            "is_target": true
          },
          {
            "ref": "pear1",
            "name": "배",
            "appearance": "꼭지가 달린 낱개 하나",
            "color": "노랑",
            "cell": [
              0,
              1
            ]
          },
          {
            "ref": "apple2",
            "name": "사과",
            "appearance": "꼭지가 달린 낱개 하나",
            "color": "빨강",
            "cell": [
              0,
              2
            ],
            "is_target": true
          },
          {
            "ref": "pear2",
            "name": "배",
            "appearance": "꼭지가 달린 낱개 하나",
            "color": "노랑",
            "cell": [
              1,
              0
            ]
          },
          {
            "ref": "pear3",
            "name": "배",
            "appearance": "꼭지가 달린 낱개 하나",
            "color": "노랑",
            "cell": [
              1,
              1
            ]
          },
          {
            "ref": "apple3",
            "name": "사과",
            "appearance": "꼭지가 달린 낱개 하나",
            "color": "빨강",
            "cell": [
              1,
              2
            ],
            "is_target": true
          },
          {
            "ref": "pear4",
            "name": "배",
            "appearance": "꼭지가 달린 낱개 하나",
            "color": "노랑",
            "cell": [
              2,
              0
            ]
          },
          {
            "ref": "apple4",
            "name": "사과",
            "appearance": "꼭지가 달린 낱개 하나",
            "color": "빨강",
            "cell": [
              2,
              1
            ],
            "is_target": true
          },
          {
            "ref": "pear5",
            "name": "배",
            "appearance": "꼭지가 달린 낱개 하나",
            "color": "노랑",
            "cell": [
              2,
              2
            ]
          }
        ]
      }
    }
  ]
}