{
  "slot_id": "EXE_05",
  "question": "첫 번째 그림의 화살표에 두 가지 규칙을 모두 적용한 그림을 고르세요. 규칙 1: 색을 파란색으로 바꾼다. 규칙 2: 시계 방향으로 90도 회전한다.",
  "answer": "2",
  "answer_rationale": "정답은 파란색으로 재색상되고 시계 방향으로 90도 회전한 화살표만 유일하게 만족한다. 보기 1은 파란색이지만 회전하지 않았고, 보기 3은 90도 회전했지만 빨간색이며, 보기 4는 파란색이지만 180도로 회전했다.",
  "panels": [
    {
      "stage": "기준",
      "kind": "scene",
      "scene": {
        "layout": "free",
        "background": "흰 바닥이 보인다",
        "objects": [
          {
            "ref": "arrow",
            "name": "화살표",
            "appearance": "오른쪽을 향한 빨간색 화살표 하나",
            "color": "빨강",
            "pos": [
              0.5,
              0.5
            ],
            "facing": "오른쪽",
            "is_target": true
          }
        ]
      }
    },
    {
      "stage": "보기",
      "kind": "option",
      "option_index": 1,
      "edit_of": "기준",
      "changes": [
        {
          "op": "recolor",
          "target": "arrow",
          "to_color": "파란색"
        }
      ]
    },
    {
      "stage": "보기",
      "kind": "option",
      "option_index": 2,
      "edit_of": "기준",
      "changes": [
        {
          "op": "recolor",
          "target": "arrow",
          "to_color": "파란색"
        },
        {
          "op": "rotate",
          "target": "arrow",
          "to_rotation": 90
        }
      ]
    },
    {
      "stage": "보기",
      "kind": "option",
      "option_index": 3,
      "edit_of": "기준",
      "changes": [
        {
          "op": "rotate",
          "target": "arrow",
          "to_rotation": 90
        }
      ]
    },
    {
      "stage": "보기",
      "kind": "option",
      "option_index": 4,
      "edit_of": "기준",
      "changes": [
        {
          "op": "recolor",
          "target": "arrow",
          "to_color": "파란색"
        },
        {
          "op": "rotate",
          "target": "arrow",
          "to_rotation": 180
        }
      ]
    }
  ]
}