{
  "slot_id": "LAN_08",
  "question": "아래 네 그림 중 '빨간 사과가 파란 잔보다 오른쪽에 있다'와 일치하는 그림을 고르시오.",
  "answer": "1",
  "answer_rationale": "정답은 1번이다. 1번만 파란 유리잔이 왼쪽 칸에 있고 빨간 사과가 오른쪽 칸에 있다. 2번은 빨간 사과가 왼쪽, 파란 유리잔이 오른쪽이라 위치가 반대이고, 3번은 오른쪽 사과의 색이 초록이라 색이 다르고, 4번은 왼쪽 잔의 색이 빨강이라 색이 다르다.",
  "panels": [
    {
      "stage": "보기",
      "kind": "option",
      "option_index": 1,
      "scene": {
        "layout": "grid",
        "rows": 1,
        "cols": 2,
        "background": "흰 바닥",
        "objects": [
          {
            "ref": "glass",
            "name": "유리잔",
            "appearance": "파란 유리잔 낱개 하나",
            "color": "파랑",
            "cell": [
              0,
              0
            ],
            "is_target": true
          },
          {
            "ref": "apple",
            "name": "사과",
            "appearance": "빨간 사과 낱개 하나",
            "color": "빨강",
            "cell": [
              0,
              1
            ],
            "is_target": true
          }
        ]
      }
    },
    {
      "stage": "보기",
      "kind": "option",
      "option_index": 2,
      "scene": {
        "layout": "grid",
        "rows": 1,
        "cols": 2,
        "background": "흰 바닥",
        "objects": [
          {
            "ref": "apple",
            "name": "사과",
            "appearance": "빨간 사과 낱개 하나",
            "color": "빨강",
            "cell": [
              0,
              0
            ],
            "is_target": true
          },
          {
            "ref": "glass",
            "name": "유리잔",
            "appearance": "파란 유리잔 낱개 하나",
            "color": "파랑",
            "cell": [
              0,
              1
            ],
            "is_target": true
          }
        ]
      }
    },
    {
      "stage": "보기",
      "kind": "option",
      "option_index": 3,
      "scene": {
        "layout": "grid",
        "rows": 1,
        "cols": 2,
        "background": "흰 바닥",
        "objects": [
          {
            "ref": "glass",
            "name": "유리잔",
            "appearance": "파란 유리잔 낱개 하나",
            "color": "파랑",
            "cell": [
              0,
              0
            ],
            "is_target": true
          },
          {
            "ref": "apple",
            "name": "사과",
            "appearance": "초록 사과 낱개 하나",
            "color": "초록",
            "cell": [
              0,
              1
            ],
            "is_target": true
          }
        ]
      }
    },
    {
      "stage": "보기",
      "kind": "option",
      "option_index": 4,
      "scene": {
        "layout": "grid",
        "rows": 1,
        "cols": 2,
        "background": "흰 바닥",
        "objects": [
          {
            "ref": "glass",
            "name": "유리잔",
            "appearance": "빨간 유리잔 낱개 하나",
            "color": "빨강",
            "cell": [
              0,
              0
            ],
            "is_target": true
          },
          {
            "ref": "apple",
            "name": "사과",
            "appearance": "빨간 사과 낱개 하나",
            "color": "빨강",
            "cell": [
              0,
              1
            ],
            "is_target": true
          }
        ]
      }
    }
  ]
}