{
  "slot_id": "VIS_06",
  "question": "세로 대칭으로 완성된 오른쪽 그림을 고르시오.",
  "answer": "2",
  "answer_rationale": "정답 2번만 두 사물을 세로 대칭 위치에 옮기고 화살표를 좌우 반전시킨다. 1번은 위치만 옮기고 반전하지 않아 화살표 방향이 틀리고, 3번은 반전만 하고 위치를 옮기지 않으며, 4번은 행을 바꿔 옮겨 세로 대칭이 아니다.",
  "panels": [
    {
      "stage": "기준",
      "kind": "scene",
      "scene": {
        "layout": "grid",
        "rows": 2,
        "cols": 2,
        "background": "흰 바닥",
        "objects": [
          {
            "ref": "tri",
            "name": "화살표",
            "appearance": "오른쪽을 향하는 주황색 화살표 낱개 하나",
            "color": "주황",
            "cell": [
              0,
              0
            ],
            "facing": "오른쪽",
            "is_target": true
          },
          {
            "ref": "square",
            "name": "사각형",
            "appearance": "파란색 정사각형 낱개 하나",
            "color": "파랑",
            "cell": [
              1,
              0
            ],
            "is_target": true
          }
        ]
      }
    },
    {
      "stage": "보기",
      "kind": "option",
      "option_index": 1,
      "edit_of": "기준",
      "changes": [
        {
          "op": "move",
          "target": "tri",
          "to_cell": [
            0,
            1
          ]
        },
        {
          "op": "move",
          "target": "square",
          "to_cell": [
            1,
            1
          ]
        }
      ]
    },
    {
      "stage": "보기",
      "kind": "option",
      "option_index": 2,
      "edit_of": "기준",
      "changes": [
        {
          "op": "move",
          "target": "tri",
          "to_cell": [
            0,
            1
          ]
        },
        {
          "op": "mirror",
          "target": "tri"
        },
        {
          "op": "move",
          "target": "square",
          "to_cell": [
            1,
            1
          ]
        },
        {
          "op": "mirror",
          "target": "square"
        }
      ]
    },
    {
      "stage": "보기",
      "kind": "option",
      "option_index": 3,
      "edit_of": "기준",
      "changes": [
        {
          "op": "mirror",
          "target": "tri"
        },
        {
          "op": "mirror",
          "target": "square"
        }
      ]
    },
    {
      "stage": "보기",
      "kind": "option",
      "option_index": 4,
      "edit_of": "기준",
      "changes": [
        {
          "op": "move",
          "target": "tri",
          "to_cell": [
            1,
            1
          ]
        },
        {
          "op": "mirror",
          "target": "tri"
        },
        {
          "op": "move",
          "target": "square",
          "to_cell": [
            0,
            1
          ]
        },
        {
          "op": "mirror",
          "target": "square"
        }
      ]
    }
  ]
}
