{
  "slot_id": "VIS_07",
  "question": "이 전개도를 접어 만든 정육면체는 어느 것입니까?",
  "answer": "2",
  "answer_rationale": "전개도를 접으면 빨간색 면과 파란색 면이 맞닿고, 보라색 면은 두 면의 위쪽에 놓인다. 빨간색 면이 화면 왼쪽, 파란색 면이 화면 오른쪽에 보이는 배치는 2번뿐이다. 1번은 두 면의 좌우가 뒤바뀌었고, 3번과 4번에는 서로 마주 보는 면이 나란히 보인다.",
  "panels": [
    {
      "stage": "기준",
      "kind": "scene",
      "scene": {
        "layout": "grid",
        "rows": 3,
        "cols": 4,
        "background": "흰 바닥이 보인다",
        "objects": [
          {
            "ref": "purple",
            "name": "정사각형",
            "appearance": "이웃 칸과 모서리가 맞닿은 전개도 조각",
            "color": "보라색",
            "cell": [
              0,
              1
            ],
            "is_target": true
          },
          {
            "ref": "red",
            "name": "정사각형",
            "appearance": "이웃 칸과 모서리가 맞닿은 전개도 조각",
            "color": "빨간색",
            "cell": [
              1,
              0
            ],
            "is_target": true
          },
          {
            "ref": "blue",
            "name": "정사각형",
            "appearance": "이웃 칸과 모서리가 맞닿은 전개도 조각",
            "color": "파란색",
            "cell": [
              1,
              1
            ],
            "is_target": true
          },
          {
            "ref": "green",
            "name": "정사각형",
            "appearance": "이웃 칸과 모서리가 맞닿은 전개도 조각",
            "color": "초록색",
            "cell": [
              1,
              2
            ],
            "is_target": true
          },
          {
            "ref": "yellow",
            "name": "정사각형",
            "appearance": "이웃 칸과 모서리가 맞닿은 전개도 조각",
            "color": "노란색",
            "cell": [
              1,
              3
            ],
            "is_target": true
          },
          {
            "ref": "orange",
            "name": "정사각형",
            "appearance": "이웃 칸과 모서리가 맞닿은 전개도 조각",
            "color": "주황색",
            "cell": [
              2,
              1
            ],
            "is_target": true
          }
        ]
      }
    },
    {
      "stage": "보기",
      "kind": "option",
      "option_index": 1,
      "scene": {
        "layout": "grid",
        "rows": 1,
        "cols": 1,
        "background": "흰 바닥이 보인다",
        "objects": [
          {
            "ref": "cube",
            "name": "정육면체",
            "appearance": "세 면이 보이는 투시도; 윗면 보라색, 화면 왼쪽 면 파란색, 화면 오른쪽 면 빨간색",
            "cell": [
              0,
              0
            ],
            "is_target": true
          }
        ]
      }
    },
    {
      "stage": "보기",
      "kind": "option",
      "option_index": 2,
      "scene": {
        "layout": "grid",
        "rows": 1,
        "cols": 1,
        "background": "흰 바닥이 보인다",
        "objects": [
          {
            "ref": "cube",
            "name": "정육면체",
            "appearance": "세 면이 보이는 투시도; 윗면 보라색, 화면 왼쪽 면 빨간색, 화면 오른쪽 면 파란색",
            "cell": [
              0,
              0
            ],
            "is_target": true
          }
        ]
      }
    },
    {
      "stage": "보기",
      "kind": "option",
      "option_index": 3,
      "scene": {
        "layout": "grid",
        "rows": 1,
        "cols": 1,
        "background": "흰 바닥이 보인다",
        "objects": [
          {
            "ref": "cube",
            "name": "정육면체",
            "appearance": "세 면이 보이는 투시도; 윗면 보라색, 화면 왼쪽 면 빨간색, 화면 오른쪽 면 초록색",
            "cell": [
              0,
              0
            ],
            "is_target": true
          }
        ]
      }
    },
    {
      "stage": "보기",
      "kind": "option",
      "option_index": 4,
      "scene": {
        "layout": "grid",
        "rows": 1,
        "cols": 1,
        "background": "흰 바닥이 보인다",
        "objects": [
          {
            "ref": "cube",
            "name": "정육면체",
            "appearance": "세 면이 보이는 투시도; 윗면 보라색, 화면 왼쪽 면 파란색, 화면 오른쪽 면 노란색",
            "cell": [
              0,
              0
            ],
            "is_target": true
          }
        ]
      }
    }
  ]
}