{
  "slot_id": "MEM_03",
  "question": "첫 번째 그림과 두 번째 그림을 비교했을 때, 자리가 바뀐 사물의 이름을 말해 주세요.",
  "answer": "열쇠",
  "answer_rationale": "검사 패널은 학습 패널에서 열쇠만 [0,1]에서 [1,1]로 이동하도록 변경되어 있고, 머그컵과 사과는 위치가 그대로 유지되므로 자리가 바뀐 사물은 열쇠 하나뿐이다.",
  "panels": [
    {
      "stage": "학습",
      "kind": "scene",
      "scene": {
        "layout": "grid",
        "rows": 2,
        "cols": 2,
        "background": "흰 바닥이 보인다",
        "objects": [
          {
            "ref": "cup",
            "name": "머그컵",
            "appearance": "손잡이 달린 흰색 낱개",
            "cell": [
              0,
              0
            ]
          },
          {
            "ref": "key",
            "name": "열쇠",
            "appearance": "열쇠고리 없는 금속 낱개 하나",
            "cell": [
              0,
              1
            ],
            "is_target": true
          },
          {
            "ref": "apple",
            "name": "사과",
            "appearance": "빨간색 원형 낱개 하나",
            "color": "빨강",
            "cell": [
              1,
              0
            ]
          }
        ]
      }
    },
    {
      "stage": "검사",
      "kind": "edit",
      "edit_of": "학습",
      "changes": [
        {
          "op": "move",
          "target": "key",
          "to_cell": [
            1,
            1
          ]
        }
      ]
    }
  ]
}