{
  "slot_id": "MEM_09",
  "question": "이전과 다른 사물은 무엇인가요?",
  "answer": "사과",
  "answer_rationale": "사과만 색상이 변경되었기 때문에 정답은 사과입니다.",
  "panels": [
    {
      "stage": "학습",
      "kind": "scene",
      "scene": {
        "layout": "grid",
        "rows": 2,
        "cols": 2,
        "background": "흰 바닥",
        "objects": [
          {
            "ref": "cup",
            "name": "머그컵",
            "appearance": "손잡이 달린 흰색 낱개",
            "cell": [
              0,
              0
            ]
          },
          {
            "ref": "key",
            "name": "열쇠",
            "appearance": "열쇠고리 없는 금속 낱개 하나",
            "cell": [
              0,
              1
            ]
          },
          {
            "ref": "apple",
            "name": "사과",
            "color": "빨강",
            "cell": [
              1,
              0
            ],
            "is_target": true
          },
          {
            "ref": "glass",
            "name": "안경",
            "appearance": "검은 뿔테",
            "cell": [
              1,
              1
            ]
          }
        ]
      }
    },
    {
      "stage": "검사",
      "kind": "edit",
      "edit_of": "학습",
      "changes": [
        {
          "op": "recolor",
          "target": "apple",
          "to_color": "초록"
        }
      ]
    }
  ]
}