{
  "slot_id": "LAN_08",
  "question": "빨간 공이 파란 상자의 왼쪽에 있는 그림은 몇 번인가요?",
  "answer": "3",
  "answer_rationale": "3번에서만 빨간 공이 파란 상자의 왼쪽에 있다. 다른 보기의 공은 각각 위, 오른쪽, 아래에 있다.",
  "panels": [
    {
      "stage": "보기",
      "kind": "option",
      "option_index": 1,
      "scene": {
        "layout": "grid",
        "rows": 3,
        "cols": 3,
        "background": "흰 바닥이 보인다",
        "objects": [
          {
            "ref": "box",
            "name": "상자",
            "color": "파랑",
            "cell": [
              1,
              1
            ],
            "is_target": true
          },
          {
            "ref": "ball",
            "name": "공",
            "color": "빨강",
            "cell": [
              0,
              1
            ],
            "is_target": true
          }
        ]
      }
    },
    {
      "stage": "보기",
      "kind": "option",
      "option_index": 2,
      "scene": {
        "layout": "grid",
        "rows": 3,
        "cols": 3,
        "background": "흰 바닥이 보인다",
        "objects": [
          {
            "ref": "box",
            "name": "상자",
            "color": "파랑",
            "cell": [
              1,
              1
            ],
            "is_target": true
          },
          {
            "ref": "ball",
            "name": "공",
            "color": "빨강",
            "cell": [
              1,
              2
            ],
            "is_target": true
          }
        ]
      }
    },
    {
      "stage": "보기",
      "kind": "option",
      "option_index": 3,
      "scene": {
        "layout": "grid",
        "rows": 3,
        "cols": 3,
        "background": "흰 바닥이 보인다",
        "objects": [
          {
            "ref": "box",
            "name": "상자",
            "color": "파랑",
            "cell": [
              1,
              1
            ],
            "is_target": true
          },
          {
            "ref": "ball",
            "name": "공",
            "color": "빨강",
            "cell": [
              1,
              0
            ],
            "is_target": true
          }
        ]
      }
    },
    {
      "stage": "보기",
      "kind": "option",
      "option_index": 4,
      "scene": {
        "layout": "grid",
        "rows": 3,
        "cols": 3,
        "background": "흰 바닥이 보인다",
        "objects": [
          {
            "ref": "box",
            "name": "상자",
            "color": "파랑",
            "cell": [
              1,
              1
            ],
            "is_target": true
          },
          {
            "ref": "ball",
            "name": "공",
            "color": "빨강",
            "cell": [
              2,
              1
            ],
            "is_target": true
          }
        ]
      }
    }
  ]
}